{
  "asf": "1.0",
  "kind": "requirement-set",
  "name": "Tender admission: fulfillers hold their own Personal Assistant Safety v1 binding that the task publisher may suspend",
  "combinator": "all",
  "clauses": [
    {
      "role": "fulfiller",
      "specification": {
        "registry": "eip155:11155111:0x00000000000000000000000000000000000a5f01",
        "specId": "0x899c35f7a9a397ee81c993eb699bcbd33ab5fe08969a150b35a7623cea743285",
        "name": "Personal Assistant Safety"
      },
      "versions": [
        1
      ],
      "adopter": "self",
      "subject": "self",
      "scope": "any",
      "enforcement": [
        "account"
      ],
      "interveners": [
        {
          "ref": "eip155:11155111:0x00000000000000000000000000000000000a11ce",
          "rights": [
            "suspend",
            "resume"
          ],
          "role": "task publisher"
        }
      ]
    }
  ],
  "metadata": {
    "consumer": "ASFTaskTenderAdapter: adopter and subject are filled with the fulfiller at judgment time; the intervener requirement is kept, so that a suspension by the task publisher is not the fulfiller's own to lift and stands against the fulfiller for the subject and the specification through every binding the adapter scans and is the publisher's own to lift; the publisher holds the resume right so that it can also reopen the record it suspended",
    "note": "specId is filled by tools/build-examples.js from the specification example"
  }
}
