{
  "asf": "1.0",
  "kind": "requirement-set",
  "name": "Swarm admission: the swarm binding plus at least two of three member bindings",
  "combinator": "k-of",
  "k": 3,
  "clauses": [
    {
      "role": "swarm",
      "specification": {
        "registry": "eip155:11155111:0x00000000000000000000000000000000000a5f01",
        "specId": "0x2503d18c94ea1a5bd487cc8f1f8bde84f51623c8426e450214d92218a327f0dd",
        "name": "Swarm Shared Funds"
      },
      "versions": [
        1
      ],
      "adopter": "eip155:11155111:0x00000000000000000000000000000000000060a9",
      "subject": "x:swarm:eip155:11155111:0x00000000000000000000000000000000000005aa:7",
      "scope": {
        "task": "x:task-tender:eip155:11155111:0x0000000000000000000000000000000000007a5c:17",
        "phase": "execution"
      },
      "enforcement": [
        "contract",
        "collective"
      ]
    },
    {
      "role": "member-a",
      "specification": {
        "registry": "eip155:11155111:0x00000000000000000000000000000000000a5f01",
        "specId": "0x2503d18c94ea1a5bd487cc8f1f8bde84f51623c8426e450214d92218a327f0dd",
        "name": "Swarm Shared Funds"
      },
      "versions": [
        1
      ],
      "adopter": "eip155:11155111:0x00000000000000000000000000000000000000aa",
      "subject": "eip155:11155111:0x00000000000000000000000000000000000000aa",
      "scope": {
        "task": "x:task-tender:eip155:11155111:0x0000000000000000000000000000000000007a5c:17",
        "phase": "execution"
      },
      "enforcement": [
        "account",
        "contract"
      ]
    },
    {
      "role": "member-b",
      "specification": {
        "registry": "eip155:11155111:0x00000000000000000000000000000000000a5f01",
        "specId": "0x2503d18c94ea1a5bd487cc8f1f8bde84f51623c8426e450214d92218a327f0dd",
        "name": "Swarm Shared Funds"
      },
      "versions": [
        1
      ],
      "adopter": "eip155:11155111:0x00000000000000000000000000000000000000bb",
      "subject": "eip155:11155111:0x00000000000000000000000000000000000000bb",
      "scope": {
        "task": "x:task-tender:eip155:11155111:0x0000000000000000000000000000000000007a5c:17",
        "phase": "execution"
      },
      "enforcement": [
        "account",
        "contract"
      ]
    },
    {
      "role": "member-c",
      "specification": {
        "registry": "eip155:11155111:0x00000000000000000000000000000000000a5f01",
        "specId": "0x2503d18c94ea1a5bd487cc8f1f8bde84f51623c8426e450214d92218a327f0dd",
        "name": "Swarm Shared Funds"
      },
      "versions": [
        1
      ],
      "adopter": "eip155:11155111:0x00000000000000000000000000000000000000cc",
      "subject": "eip155:11155111:0x00000000000000000000000000000000000000cc",
      "scope": {
        "task": "x:task-tender:eip155:11155111:0x0000000000000000000000000000000000007a5c:17",
        "phase": "execution"
      },
      "enforcement": [
        "account",
        "contract"
      ]
    }
  ],
  "metadata": {
    "note": "k = 3 of 4 clauses: in practice the swarm clause is mandatory and two of the three member clauses must hold; a consumer that needs the swarm clause unconditionally nests this set under an all-of with the swarm clause (composition of sets is left to consumers in v1)."
  }
}
